title,year,imdb_id,director,country,canonical_tier,source,notes
Dona Flor And Her Two Husbands,1976,,Bruno Barreto,BR,1,Johnson 1987 p.143,"Barreto international breakthrough; highest-grossing BR film of era; Johnson's primary pornochanchada example"
Excitacao,1976,,Jean Garret,BR,1,Ramos 1987 p.212,"Garret defines mid-1970s pornochanchada style; Ramos core case study"
Possuidas Pelo Pecado,1976,,Jean Garret,BR,1,Ramos 1987,"Garret canonical pornochanchada; country/sex/samba formula"
Noite Em Chamas,1977,,Jean Garret,BR,2,Ramos 1987,"Garret production-line middle period; genre texture"
Mulher Mulher,1979,,Jean Garret,BR,2,Ramos 1987,"Garret late-1970s; women's exploitation sub-genre"
Anjo Loiro,1973,,Alfredo Sternheim,BR,2,Johnson 1987,"Sternheim early pornochanchada; genre establishment phase"
As Deusas,1972,,Walter Hugo Khouri,BR,2,Johnson 1987 p.119,"Khouri art-exploitation crossover; Johnson discusses dual audience"
Escola Penal De Meninas Violentadas,1977,,Antonio Meliande,BR,2,Ramos 1987,"Women's-prison exploitation; Meliande peak period"
Os Imorais,1979,,Geraldo Vietri,BR,2,Ramos 1987,"Vietri pornochanchada; late-1970s genre maturity"
Sexo Sua Unica Arma,1981,,Geraldo Vietri,BR,2,Ramos 1987,"Vietri early-1980s; genre extension into explicit period"
Belinda dos Orixas na Praia dos Desejos,1979,,Antonio Bonacin Thome,BR,3,Ramos 1987,"Afro-Brazilian exploitation crossover; genre texture"
As Cariocas,1966,,Fernando De Barros,BR,3,Johnson 1987 p.98,"Early chanchada-pornochanchada transition; pre-movement texture"
Quando o Carnaval Chegar,1972,,Carlos Diegues,BR,3,Johnson 1987,"Diegues carnivalesque; art-exploitation overlap; discussed as genre border case"
Liliam a Suja,1981,,Antonio Meliande,BR,3,Ramos 1987,"Meliande early-1980s; explicit period genre texture"
Vadias Pelo Prazer,1982,,Antonio Meliande,BR,3,Ramos 1987,"Meliande late period; genre texture"
Giselle,1980,,Victor di Mello,BR,2,Johnson 1987 p.161,"Di Mello key pornochanchada director; Giselle widely cited as movement landmark"
Rio Babilonia,1982,,Neville D'Almeida,BR,3,Ramos 1987,"D'Almeida urban exploitation; early-1980s cycle"
As Intimidades de Analu e Fernanda,1980,,José Miziara,BR,3,Ramos 1987,"Miziara women's exploitation; genre texture"
A Dama do Cine Shanghai,1987,,Guilherme de Almeida Prado,BR,3,Johnson 1987,"Late-period; genre reflexivity; Prado in Johnson's post-pornochanchada discussion"
Ariella,1980,,John Herbert,BR,3,Ramos 1987,"Herbert softcore; genre texture"
A Espiã que Entrou em Fria,1967,,Sanin Cherques,BR,3,Johnson 1987 p.95,"Pre-pornochanchada spy-comedy; early exploitation genre"
O Corpo,1991,,José Antonio Garcia,BR,3,Ramos 1987,"Post-pornochanchada; 1990s survival period"
Bye Bye Brasil,1980,,Carlos Diegues,BR,3,Johnson 1987 p.168,"Diegues; art-cinema crossover but frequently discussed alongside pornochanchada wave"
Vai Trabalhar Vagabundo II,1991,,Hugo Carvana,BR,3,Ramos 1987,"Sequel cycle; late-period genre"
Santo Forte,1999,,Eduardo Coutinho,BR,3,Johnson 1987,"Coutinho documentary strain; social-realist arm of BR exploitation tradition"
